id,title,image_link,country,years,director_description,leader,star,description,all_tags,imdb,language,time_length,Unnamed: 13
61,Haijie diary Haijie diary,https://img1.doubanio.com/view/photo/s_ratio_poster/public/p2232247487.jpg,Japan,2015-05-14(戛纳电影节),Kore-eda Hirokazu,"['Ayase Haruka', 'Nagasawa Masami', 'Kaho', 'Hirose Suzu', 'Otake Shinobu', 'tsutsuki Shinichi', 'Kase Ryo', 'Fazeki Jun', 'Nakagawa Masaya', 'Maeda Oshiro', 'Suzuki Ryohei', 'Sakaguchi Kentaro', 'Kuki Shirin']",8.8,"Kamakura, the ancient capital by the sea, is a small town along the mountains. In an inconspicuous corner, there live the four sisters of the Xiangda family. Their father ran away from home with his lover in his early years, and their mother simply left the girls in the care of their grandmother. After their grandmother passed away, the granddaughters inherited this large house with a long history. The elder sister Koda Yuki (played by Haruka Ayase), who took on the responsibility of the family prematurely, does her best to take care of the healthy growth of her two younger sisters Kano (played by Masami Nagasawa) and Chika (played by Kaho). On this day, the news of his father's death reached the sisters. They attended their father's funeral together and got acquainted with Qian YeLing (Hirose Sisi), an half-sister they had never met. Xu was close to her by blood, so she invited Suzu to move to Kamakura before leaving. Not long after, Ling walked into the house where her father once lived, holding the longing for her sisters. As the seasons pass, the stories of the sisters are quietly unfolding...
                                    
                                This film is adapted from the manga of the same name by Yoshida Akio.",Drama/Family,https://www.imdb.com/title/tt3756788,Japanese,127分钟,
62,twenty-two,https://img1.doubanio.com/view/photo/s_ratio_poster/public/p2457609817.jpg,Chinese mainland,2017-08-14(中国大陆),Guo Ke,,8.7,"During the eight years of Japan's war of aggression against China, at least 200,000 Chinese women were forced to become sex slaves of the Japanese army, which we often refer to as ""comfort women."" When the film started filming in 2014, there were only 22 ""comfort women"" survivors left in mainland China. As time passes slowly and time heals the wounds, where are these old people who have gone through unimaginable hardships, what kind of lives are they living, and what kind of joys and sorrows are they experiencing?",documentary,https://www.imdb.com/title/tt3843282,Mandarin Chinese,99分钟(公映版),
63,Manchester by the Sea Manchester by the Sea,https://img9.doubanio.com/view/photo/s_ratio_poster/public/p2421855655.jpg,USA,2017-08-25(中国大陆),Kenneth Lonergan,"['Casey Affleck', 'Lucas Hedges', 'Michelle Williams', 'C.J. Wilson', 'Kyle Chandler', 'Kara Hayward', 'Gretchen Moore', 'Tate Donovan', 'Erica McDermott', 'Heather Burns', 'Missy Younger', 'Stephen Henderson', 'Ben Henson', 'Mary Mellen', 'Anthony Estella', 'Susan Porfa', 'Robert Serra', 'Caroline Pickman', 'Josh Hamilton', 'Sean Fitzgibbon', 'Kenneth Lonergan', 'Anna Baryshnikov', 'Liam McNeill', 'Matthew Broderick', 'Kt Badassaro', 'William Bornkessel', 'Frank D'Agostino', 'Thomas Mariano']",8.6,"Lee (Casey Affleck) is a decadent and depressed repairman. After learning of the death of his brother Joey (Kyle Chandler), Lee returned to his hometown of Manchester-by-the-Sea to deal with Joey's funeral. According to Joey's will, Lee will become the guardian of Joey's son Patrick (Lucas Hedges). Lee plans to take Patrick back to Boston, but it is obvious that Patrick is not willing to leave his hometown and friends, but Lee is also unwilling to stay in this sad place for a long time.
                                    
                                It turns out that Manchester contains a desperate memory of Lee. His fault caused his two daughters to be killed in a sea of fire, and his wife Randy (Michelle Williams) also left him. Returning to his hometown this time, Lee once again met Randy, who had remarried and was about to become a mother. At the same time, Patrick's long-lost mother Alice (Gretchen Mol) also contacted Patrick, hoping that he could become a member of her new family.",Drama/Family,https://www.imdb.com/title/tt4034228,English,137分钟,
64,Room Room,https://img9.doubanio.com/view/photo/s_ratio_poster/public/p2259715855.jpg,Ireland / Canada / United Kingdom / United States,2015-09-04(特柳赖德电影节),Lenny Abrahamson,"['Brie Larson', 'Jacob Tremblay', 'Shaun Briggs', 'Wendy Crewssen', 'Amanda Bruegel', 'Jo Pinge', 'Joan Allen', 'Cass Anwar', 'William H. Macy', 'Randall Edward', 'Rodrigo Fernandez-Stoll', 'Rory O'Shea', 'Tom McCamus', 'Jack Fulton', 'Megan Parker']",8.8,"A girl named Joy (Brie Larson) was abducted by a man named ""Old Nick"" and then imprisoned by him in a shed in the backyard of his house for seven years. During this period she was raped and gave birth to her son Jack (Jacob Tremblay). Relying on supplies from old Nick from time to time, the mother and son lived a difficult life. Despite this, the mother did her best to create a safe and happy space for her son Jack to grow up. This small and cramped room became a magical little world where Jack lived and grew up. After Jack spent his fifth birthday, his mother decided to tell him the truth. There was a wider world outside this small room. They began to plan an escape plan, determined to escape from the room where they were imprisoned...
                                    
                                The film is adapted from the novel of the same name by Emma Donahue.",Drama/Family,https://www.imdb.com/title/tt3170832,English,118分钟,
65,Psycho,https://img9.doubanio.com/view/photo/s_ratio_poster/public/p1021883305.jpg,USA,1960-06-16(纽约首映),alfred hitchcock,"['Anthony Perkins', 'Vera Miles', 'John Gavin', 'Janet Leigh', 'Martin Balsam', 'John McIntyre', 'Simon Oakland', 'Frank Albertson', 'Patricia Hitchcock', 'Vaughn Taylor', 'Lullon Tuttle', 'John Anderson', 'Mort Mills', 'Jit Carson', 'Virginia Gregg', 'Alfred Hitchcock', 'Janet Nolan', 'Robert Osborne', 'Helen Wallace', 'Fletcher Allen', 'Walter Bacon', 'Francis De Sales', 'George Dockstader', 'George Eldredge', 'Harper Flaherty', 'Sam Flint', 'Frank Killmond', 'Ted Knight', 'Pat McCaffrie', 'Hans-Joachim Moebis', 'Fred Scheiwiller']",9.0,"Young Marion Crane (played by Janet Leigh) works in Phoenix and is deeply trusted by her boss Lowery (played by Vaughn Taylor). Her boyfriend Sam Loomis (played by John Gavin) runs a hardware store in Fairvale. Because he has to pay off his late father's debts and pay alimony to his ex-wife, he is unable to remarry. He can only take advantage of business trips to occasionally have a tryst with Marion. Marion was dissatisfied with this and took the opportunity to abscond with $40,000 in public funds on Friday afternoon. However, Marion's escape was not smooth: he was first witnessed by Lowery when he was leaving the city, and he was suspected by the police early Saturday morning. After spending seven hundred dollars to trade in his old car for a new one, Marion continued to drive nervously. After nightfall, it rained heavily, making it impossible to drive due to blurred vision. Marion had no choice but to park his car at the Bates Motel on the roadside and stay overnight. The boss Norman (Anthony Perkins) was very friendly and tried to invite Marion to his home for dinner. Unfortunately, his vicious mother violently stopped him and had to bring the dinner to the hotel living room. Marion chatted with Norman while eating in the living room, and finally decided to return to Phoenix on Sunday. After the meal, Marion went back to her room to take a shower. At this time, the figure of an old woman...",Suspense/Thriller/Horror,https://www.imdb.com/title/tt0054215,English,109分钟,
66,Escape from the tiger's mouth La grande vadrouille,https://img3.doubanio.com/view/photo/s_ratio_poster/public/p2399597512.jpg,France/UK,1966-12-08(法国),Gérard Ury,"['Louis de Finèse', 'Bourville', 'Claudio Brooke', 'Andrée Parisi', 'Colette Brosset', 'Mike Marshall', 'Marie Mackay', 'Pierre Bertin', 'Benno Stezenbach', 'Marie Dubois', 'Terry-Thomas', 'Sigurd Rapp', 'Reinhard Kolderhoff', 'Helmut Schneider', 'Paul Preboist', 'Hans Mayer', 'Guy Grosso', 'Michel Maudeau', 'Peter Jacob', 'Rudy Lenoir', 'Noël Dazal', 'Pierre Roussel', 'Pierre Bastien', 'Jacques Sablon', 'Marg Avril', 'Jacques Baudoin', 'Gabriel Gobain', 'Paul Messer', 'Henry Genes']",8.9,"During World War II, a British aircraft was hit by the Germans during a bombing mission, and several British soldiers were forced to parachute to escape. They made an appointment to meet at the Turkish bath and used the codename of the operation ""Yuanyang Tea"" as their secret code.
                                    
                                They landed at different locations in the German-occupied areas of Paris, France. Bearded squadron leader Reginald is rescued by a zookeeper. The other two soldiers also hid themselves with the help of painter Auguste (played by Bulwer) and band conductor Stanislas (played by Louis de Fernes). Even though the German army launched a city-wide search, the painter, the commander and the squadron leader still met smoothly in the bathroom. After several twists and turns, the British soldiers finally took the lead. Several people who did not know each other formed a life-and-death alliance and started a life-and-death game of wits and courage with the enemy. At the same time, there were also many warm jokes. They used their meager strength to fight against the brutal German army, encountering dangers and being funny, fighting together in order to escape from the tiger's mouth.",comedy/war,https://www.imdb.com/title/tt0060474,French/English/German,132分钟,
67,Horror Cruise Triangle,https://img9.doubanio.com/view/photo/s_ratio_poster/public/p462470694.jpg,UK/Australia,2009-10-16(英国),Christopher Smith,"['Melissa George', 'Liam Hemsworth', 'Michael Dorman', 'Rachel Capani', 'Emma Long', 'Henry Nixon', 'Joshua McKeever']",8.5,"Single mother Jesse (Melissa George) goes out on a yacht with a group of friends, but she always has a feeling that something bad is going on. Soon, they encountered a strong storm at sea. The yacht capsized and fell into the sea. After several struggles, they finally climbed onto the wreckage of the yacht. Just when they were at their wits' end, a huge cruise ship slowly approached everyone. ship that disappeared in 1930, and there was no one on board.
                                    
                                The blood, mysterious instructions and sudden murders that can be seen everywhere bring these men and women into a terrifying reincarnation that will never be restored...",Drama/Suspense/Thriller,https://www.imdb.com/title/tt1187064,English,99 分钟,
68,wonder boy wonder,https://img1.doubanio.com/view/photo/s_ratio_poster/public/p2507709428.jpg,"United States / Hong Kong, China",2018-01-19(中国大陆),Stephen Chbosky,"['Jacob Tremblay', 'Julia Roberts', 'Izabella Vidovich', 'Owen Wilson', 'Noah Jupe', 'Danielle Rose Russell', 'Najib Jeter', 'Daveed Diggs', 'Mandy Patinkin', 'Bryce Gizard', 'Al McKinnon', 'Ty Consiglio', 'James Hughes', 'Kyle Breitkopf', 'Millie Davis', 'Leah Jewett', 'Kailyn Breitkopf', 'Liam Dickinson', 'Emma Tremblay', 'Mark Dozlaw', 'Rukia Bernard', 'J. Douglas Stewart', 'Ari Liebert', 'Erica McKittrick', 'Benjamin Ratner', 'Jason McKinnon', 'Sonya Braga', 'Gidget']",8.6,"Auggie (Jacob Tremblay) is a 10-year-old boy. Except for wearing a huge space helmet on his head, he is just like other children of the same age. Under the helmet, Auggie's face was scarred due to various surgeries. It not only perfectly concealed Auggie's fragile and inferior heart, but also successfully prevented Auggie's appearance from scaring other children.
                                    
                                Auggie never went to school, and all his cultural knowledge was taught to him at home by his mother Isabel (Julia Roberts). However, Isabel gradually felt that the family classroom could not meet Auggie's growth needs. In addition to learning knowledge, Auggie also had to learn how to communicate with people other than family members. Amidst the worries, Isabel sent Auggie to a public school, where Auggie faced the challenges that he must overcome in his life.",Drama/Family/Children,https://www.imdb.com/title/tt2543472,English,113分钟,
69,Kiki's Delivery Service Kiki's Delivery Service,https://img3.doubanio.com/view/photo/s_ratio_poster/public/p456676352.jpg,Japan,1989-07-29(日本),Hayao Miyazaki,"['Takayama Minami', 'Sakuma Rei', 'Toda Keiko', 'Yamaguchi Kappei', 'Nobusawa Mieko', 'Kato Hariko', 'Seki Hiroko', 'Miura Koichi', 'Yamdera Koichi', 'Inoue Kikuko', 'Fuchizaki Yuriko', 'Doi Mika', 'Takaya Toshi', 'Asai Yoshiko', 'Saito Masaru', 'Nishimura knows', 'Yuko Kobayashi', 'Chisui Tongyei', 'Tsuji Chihachi', 'Otsuka Akio', 'Chinatsu Sakamoto', 'Taguchi Ang', 'Kaimoto Keiko', 'Tsuga Yuko', 'Kamei Yoshiko', 'Maruyama Yuko']",8.6,"Qiqi is 13 years old this year. According to the rules of the magic world, magical girls must go out for a year of training when they turn 13 years old. So Qiqi embarked on a spiritual journey with her pet black cat Jiji. However, the journey of spiritual practice did not start smoothly. When Qiqi came to a big city by the sea, people did not welcome her arrival and everyone ignored her. Fortunately, Qiqi has a kind heart. When she found something lost by someone else, the enthusiastic Qiqi found the owner. Her kindness won the favor of the bakery proprietress, and Qiqi started her express delivery business using flying magic to serve customers in the bakery. Qiqi quickly adapted to the new environment. Once, a boy who was passionate about airplane manufacturing invited Qiqi to a flying club party. On the way, Qiqi got caught in the rain because she was helping an old lady deliver something. From then on, Qiqi suddenly found that her magic was getting weaker day by day.",Animation/Fantasy/Adventure,https://www.imdb.com/title/tt0097814,Japanese,103分钟,
70,Artificial Intelligence: AI,https://img1.doubanio.com/view/photo/s_ratio_poster/public/p792257137.jpg,USA,2001-06-29(美国),Steven Spielberg,"['Haley Joel Osment', 'Frances O'Connor', 'Sam Robards', 'Jack Thomas', 'Jude Law', 'William Hurt', 'Ken Liang', 'Clark Gregg', 'Kevin Sussman', 'Tom Gallop', 'Eugene Osment', 'April Grace', 'Matt Winston', 'Sabrina Gedwitch', 'Theo Greenlee']",8.6,"In the mid-21st century, due to the greenhouse effect, the glaciers in the Arctic and Antarctic melted, and many cities on the earth were submerged. At this time, human technology has been highly developed. Artificial intelligence robots are one of the technological means invented by humans to deal with the harsh natural environment. Moreover, robot manufacturing technology has been highly developed. Advanced robots not only have the appearance of real humans, but can also sense their own existence.
                                    
                                Monica's son Martin is seriously ill in the hospital and his life is in danger. In order to ease the pain, she adopts a robot child David (Haley Joel Osment). David's mission in life is to love her. Martin woke up, recovered, and returned home. A series of things made David ""fall out of favor"" and was finally abandoned by Monica.
                                    
                                After escaping the brutal pursuit of the robot slaughterhouse, David, with the help of his robot lover Joe (Jude Law), began to find the value of his own survival: he longed to become a real child and return to his mother Monica. No one knows whether he can fulfill his wish and become a real person. What awaits them is an unpredictable journey...",Drama/Science Fiction/Adventure,https://www.imdb.com/title/tt0212720,English,146分钟,
71,Singin' in the Rain,https://img9.doubanio.com/view/photo/s_ratio_poster/public/p1612355875.jpg,USA,1952-04-11(美国),Stanley Donan,"['Gene Kelly', 'Donald O'Connor', 'Debbie Reynolds', 'Jane Hagen', 'Millard Mitchell', 'Cyd Charisse', 'Dagras Foley', 'Rita Moreno', 'Dawn Addas', 'John Albright', 'Betty Allen', 'Bette Arlen', 'David Bair', 'Margaret Burt', 'Madge Blake', 'Gail Bonney', 'Chetenburg Brand', 'May Clark', 'Harry Cody', 'Chick Collins', 'Pat Conway', 'Jeanne Coyne', 'Fred Datig Jr.', 'Kay Deslys', 'John Dodsworth', 'Kim Donovan', 'Phil Dunham', 'Helen Abbey Rock', 'Richard Emory', 'Tommy Farrell', 'Ernie Flatt', 'Beth Flowers', 'Robert Foulk', 'Dan Foster', 'Robert Foulk', 'Eric Freeman', 'Katherine Freeman', 'Lance Fuller', 'Jack George', 'John George', 'Inez Gorman', 'A. Cameron Grant', 'Beatrice Gray', 'William Hamel', 'Sam Harris', 'Timmy Hawkins', 'Jean Heremans', 'Stuart Holmes', 'Kenner G. Kemp', 'Mike Larry', 'Joy Lansing', 'William F. Leicester', 'Sylvia Lewis']",9.0,"In 1927, ""Royal Scoundrel"" starring Don Lockwood (Gene Kelly) and Lena Raymond (Jane Hagen) premiered in Hollywood. Since Lina's harsh voice could not match her dazzling appearance, in order to maintain her star image, the publicity department had to arrange for Tang to speak alone. After the premiere, due to pianist Cosmo Brown's (Donald O'Connor) car having a flat tire, in order to avoid crazy fans, Don accidentally met Kathy Selden (Debbie Reynolds), who is good at singing and dancing, and was deeply attracted to her. A few weeks later, the first talkie film ""The Jazz Singer"" became a hit. Don and Lina's new film ""The Duel Knights"" had to temporarily change the filming method, and Cathy also became a musical actor. Due to the extremely poor reputation at the preview, Cosmo proposed changing ""The Knights"" into a musical, with Casey dubbing Lina, and Casey actively seconded the proposal. After kissing Cathy goodbye, Tang was filled with joy and sang and danced in the rain. Will Cosmo's plan work? Can Casey, who is behind the scenes, come to the stage to accept the applause of the audience?",Comedy/Romance/Song and Dance,https://www.imdb.com/title/tt0045152,English,103分钟,
72,crazy stone,https://img3.doubanio.com/view/photo/s_ratio_poster/public/p712241453.jpg,"Mainland China/Hong Kong, China",2006-06-30(中国大陆),Ning Hao,"['Guo Tao', 'Liu Hua', 'Lian Jin', 'Huang Bo', 'Xu Zheng', 'Youhui', 'Luo Lan', 'Wang Xun']",8.5,"A handicraft factory in Chongqing is on the verge of closing down, but when the old factory was demolished, unexpectedly, a priceless jade was discovered in the toilet. The factory decided to use this piece of jade to hold an exhibition to earn some money to pay the wages owed to the workers for several months. During this period, Bao Shihong (played by Guo Tao), the security section chief of the handicraft factory, was responsible for guarding this treasure. However, the international thief Mike and a group of local thieves left Bao Shihong at a loss. They each used their own skills to get close to Jade, and a battle between overt and covert fighting began in the exhibition hall. Black humor also began to play out. How much is jade worth? Who is the winner in the end? Things are far from being as simple as they appear...",comedy/crime,https://www.imdb.com/title/tt0843270,Chinese Mandarin / Chongqing dialect,106 分钟(香港),
73,"A family of thieves, a family of thieves",https://img9.doubanio.com/view/photo/s_ratio_poster/public/p2530599636.jpg,Japan,2018-08-03(中国大陆),Kore-eda Hirokazu,"['Nakagawa Masaya', 'Ando Sakura', 'Matsuoka Mayu', 'Castle Hinoki', 'Sasaki Miyuki', 'Kiki Kirin', 'Ogata Naoto', 'Ikematsu Soryō', 'Moriguchi Yōko', 'Yamada Yuki', 'Katama Moemi', 'Emoto Akira', 'Kora Kengo', 'Ikewaki Chizuru', 'Adachi Tomomitsu']",8.7,"In the middle of Tokyo's urban jungle, an old and shabby old house remains. Shibata's family of five lives here crampedly. Aji (played by Lily Franky), a man who works as a temporary worker at a construction site, often takes his son Shota (played by Shiro Hinoki) to the supermarket to steal daily necessities. On this day, on their way home, they met Yuri (played by Sasaki Miyuki), a four-year-old girl who was staying alone outdoors. His wife Shindai (played by Sakura Ando) initially strongly advocated sending the girl back to her parents, but she felt compassion when she saw the situation of the girl's native family. Originally, the Shibata family relied on the pension of the old lady Hatsue (played by Shirin Kuki). Now that there is an extra person, it is naturally a little more difficult. Including Shindai's sister Aki (played by Matsuoka Mayu), although the family is wandering on the edge of poverty and illegality, their deep fetters tightly connect them so that their hearts will not become cold with the cold city...
                                    
                                The film won the Palme d'Or at the 71st Cannes Film Festival",Drama/Family/Crime,https://www.imdb.com/title/tt8075192,Japanese,117分钟(中国大陆),
74,Love Before Midnight,https://img1.doubanio.com/view/photo/s_ratio_poster/public/p2074715729.jpg,USA/Greece,2013-06-14(美国),Richard Linklater,"['Ethan Hawke', 'Julie Delpy', 'Shoms David-Fitzpatrick', 'Jennifer Prior', 'Charlotte Prior', 'Xenia Kalogeropoulou', 'Walter Lassally', 'Arianne Labed', 'Yannis Papadopoulos', 'Arsena Rahel Changari', 'Panos Koronis', 'Yota Argyropoulou', 'John Sloss']",8.8,"""Before Dawn"" and ""Love Before Sunset"", regarded as the classics of love by movie fans, finally ushered in the third film ""Before Midnight"". In the first part, American young Jesse (Ethan Hawke) meets French girl Celine (Julie Delpy) on a train, and the two spend an unforgettable night in Vienna; in the second part 9 years later, Jesse has become a writer, and his novel reunites him and Celine in Paris, and the two renew their relationship before sunset. Now another nine years have passed. Jesse and Celine have lived together and have twin daughters, and they have learned more about life and love. ""Love Before Midnight"" captures the last day of their vacation on a small island in the southern Peloponnese, Greece.
                                        
                                    Director Richard Linklater and the two leading actors are like going on a nine-year date with movie fans. Although the production span of the trilogy spans 18 years, the storyline can almost be written on the back of a piece of paper. Movies are accustomed to telling stories only through dialogue between people. The two protagonists are either walking in a quiet village, or sitting leisurely on the terrace or at the dining table, constantly discussing topics such as literature, love, life, gender...",Drama/Romance,https://www.imdb.com/title/tt2209418,English/Greek/French,109分钟,
75,Once Upon a Time in America,https://img1.doubanio.com/view/photo/s_ratio_poster/public/p477229647.jpg,USA/Italy,1984-02-17(波士顿首映),Sergio Leone,"['Robert De Niro', 'James Woods', 'Elizabeth McGovern', 'Joe Pesci', 'Porter Young', 'Tusday Weld', 'Treat Williams', 'Danny Aiello', 'Richard Bright', 'James Hayden', 'William Forsythe', 'Dallanie Flueger', 'Larry Rapp', 'Richard Fernando', 'Robert Harper', 'Jennifer Connelly']",9.2,"In the United States in the 1920s, New York teenager ""Noodles"" (played by Robert De Niro) and several friends of the same age met the smart and cunning ""Maggie"" (played by James Woods), and they began to engage in smuggling activities. Soon, Noodles killed someone in a fight and was imprisoned.
                                    
                                Several years later, ""Noodles"" was released from prison. His friends at that time had turned into strong young people. Under the leadership of ""Mai Da"", they started a series of robbery, theft and extortion activities. As the criminal activities continued to deepen, ""Mai Da"" seemed to be dazzled by the victory, and even included the Federal Reserve Bank of the United States as an action target. ""Noodles"" couldn't bear to see his friend go to ruin, so he secretly called the police, hoping to force ""Mai Da"" to stop. A fierce gun battle broke out between the police and ""Noodles""'s friends, and ""Mai Da"" and others were all killed. With deep regret and pain, ""Noodles"" left New York and returned to the place where he grew up when he was young.
                                    
                                Thirty-five years have passed, and the nearly twilight ""Noodles"" returned to the sad place of New York. He met his childhood friends and old lovers, and there was an unexpected conspiracy behind the deaths of ""Mai Da"" and the others.",Drama/Crime,https://www.imdb.com/title/tt0087843,English / French / Italian,229分钟(导演剪辑版),
