id,title,image_link,country,years,director_description,leader,star,description,all_tags,imdb,language,time_length,Unnamed: 13
189,Pride & Prejudice Pride & Prejudice,https://img1.doubanio.com/view/photo/s_ratio_poster/public/p2016401659.jpg,France / United Kingdom / United States,2005-09-16(英国),Joe Wright,"['Keira Knightley', 'Matthew Macfadyen', 'Donald Sutherland', 'Brenda Bryce', 'Carey Mulligan', 'Pike Rosamund', 'Gina Malone', 'Dalula Riley', 'Judi Dench', 'Simon Woods', 'Claudie Blackley', 'Tom Holland', 'Rupert Friend', 'Kelly Reilly', 'Pip Torrance', 'Sinead Matthews', 'Penelope Wilton', 'Tamkin Merchant']",8.6,"Based on Jane Austen's novel of the same name. Elizabeth Bennet (played by Keira Knightley) was born into a small landowner family and has four sisters. Her mother, Mrs. Bennet, worries about finding a satisfactory husband for her daughter all day long. The new neighbor Mr. Bingley and his friend Darcy (Matthew Macfadyen) break up the family's monotonous country life. Bingle and Elizabeth's sister Jane Bennet had a mutual affection; Darcy developed a liking for the kind and intelligent Elizabeth, but Elizabeth was prejudiced against Darcy's arrogance and did not accept his feelings. However, things are unpredictable, and the relationship between Bingle and Jane Bennet is in danger due to misunderstanding. Darcy's various actions show the same kind side of his character as Elizabeth, and gradually wins Elizabeth's favor. Can two pairs of lovers finally get married? Can the Bennet sisters get the life they want?
                                    
                                The British rural life and social scene in the early 19th century described by Jane Austen are re-presented on the big screen.",Drama/Romance,https://www.imdb.com/title/tt0414387,English,129 分钟,
190,fruit of life fruit of life,https://img3.doubanio.com/view/photo/s_ratio_poster/public/p2544912792.jpg,Japan,2017-01-02(日本),Kenyuki Fukuhara,"['Shuichi Tsutata', 'Eiko Tsutata', 'Shuki Lin']",9.5,"An extremely touching documentary film ""Life of Accumulated Time"", shot by Japanese director Kenyuki Fukuhara, with Japanese movie queen Shirin Kiki as the narrator, a documentary about the life of the Japanese modern Tao Yuanming and his wife. Through the rich life experiences of Shuichi Tsuda and his wife, a cabin deep in the woods, we can explore the real treasures hidden in the long river of time.
                                        
                                    An extremely touching documentary film, shot by Japanese director Kenyuki Fukuhara, who had a background in journalism. After visiting the thatched cottage three times, he finally received the nod of ""We are willing to assist"" from the reclusive mountain architect Shuichi Tsubata and his wife Eiko with four letters, and began to shoot the film.
                                        
                                    A small house deep in the forest is located in a corner of Kozoji New Town, Japan. It was built by architect Shuichi Tsuba based on the proud wooden house of his master Anthony Raymond. There are thousands of scenery throughout the year, and hundreds of fruits and vegetables planted in the garden have become delicacies through the skillful hands of his wife Eiko. Whether cooking, tailoring, or farming, nothing could stop her. Their homes are full of thoughtfulness and care, confirming the famous saying of the architect Kobe Bryant, ""A house should be a treasure box of life.""
                                        
                                    Shuichi Tsubata was the chief architect of the Japan Housing Corporation. In the 1960s, he proposed to preserve the woods to clear the way for the wind...",documentary,https://www.imdb.com/title/tt6161512,Japanese,91分钟,
191,Time Traveler About Time,https://img9.doubanio.com/view/photo/s_ratio_poster/public/p2070153774.jpg,U.K.,2013-09-04(英国),Richard Curtis,"['Domhnall Gleeson', 'Rachel McAdams', 'Bill Nighy', 'Lydia Wilson', 'Lindsay Duncan', 'Richard Corddry', 'Joshua McGuire', 'Tom Holland', 'Margot Robbie', 'Will Merrick', 'Vanessa Kirby', 'Tom Hughes', 'Harry Hayden-Payton', 'Mitchell Mullen', 'Lisa Aikorn', 'Jenny Rainsford', 'Philip Worth', 'Katherine Steadman', 'Tom Stoughton', 'Haruka Abe', 'Lee Asquith-Coe', 'Richard Banks', 'Paul Blackwell', 'Bain Colaco', 'Gram Currie', 'Rovina Diamond', 'John Duggan', 'Dino Fazzani', 'Neve Gachev', 'Richard E. Grant', 'Richard Graves', 'Lee Nicholas Harris', 'Richard Herdman', 'Lee Fairy Lake', 'Matthew C. Martino', 'Martin McGonagall', 'Alex Moore']",8.7,"Tim (Domhnall Gleeson) is 21 years old. His father (Bill Nighy) tells him that the men in his family have the super power of time travel and can go back to the past. So Tim gave it a try suspiciously and returned to the summer, where he tried to change his relationship with his crush, but found that no matter how he traveled through time and space, he couldn't make someone who didn't love you fall in love with you. After that Tim came to London and became a lawyer. He fell in love with a beautiful girl Mary (Rachel McAdams), and through several time travels, he tried hard to become Mary's boyfriend. Later, he tried to save a failed drama through time travel, to improve his sister's life, to get along better with relatives and friends, and to spend every day of his life.",Comedy/Romance/Fantasy,https://www.imdb.com/title/tt2194499,English,123分钟,
192,City of God Cidade de Deus,https://img3.doubanio.com/view/photo/s_ratio_poster/public/p455677490.jpg,Brazil/France,2002-05-18(戛纳电影节),Fernando Merrills,"['Alessandre Rodriguez', 'Leandre Firmino', 'Felipe Haagenson', 'Douglas Silva', 'Jonathan Haagenson', 'Matthews Nakgal', 'So Hauhe', 'Elise Braga']",8.9,"The slums of Rio de Janeiro, Brazil, are the ""City of God"" and a place where even the devil would sigh and turn around.
                                        
                                    A Pao (played by Alexandre Rodrigues) took us here. He witnessed the chaotic life here for more than years, which was wrapped up in cruelty, greed, revenge, ambition, betrayal, and plunder, and ultimately led to a disastrous gang war. Although he has been among gangsters since he was a child to survive, his timid character and self-protection instinct have allowed him to live peacefully.
                                        
                                    In the early 1960s, Ah Mao, Ah Jia and Ah Dai were the ""Three Young Heroes"" here. After robbing the hotel, the three of them parted ways. Ah Jia returned to the embrace of God, while Ah Dai and Ah Dai paid the price with their lives.
                                        
                                    In the 1970s, Xiaodouzi (Douglas Silva), a younger brother of the ""Three Young Heroes"", relied on his ruthlessness to constantly annex other people's territory and became the ""little overlord"" in the slums. His business also upgraded from robbery to a more profitable drug trade. Benny (Phellipe Haagensen) also prospered with him.
                                        
                                    Benny met the beautiful Ann...",Drama/Crime,https://www.imdb.com/title/tt0317248,Portuguese,130分钟,
193,The Godfather: Part III,https://img3.doubanio.com/view/photo/s_ratio_poster/public/p2169664351.jpg,USA,1990-12-25(美国),Francis Ford Coppola,"['Al Pacino', 'Diane Keaton', 'Talia Shire', 'Andy Garcia', 'Eri Wallach', 'Joe Mantegna', 'George Hamilton', 'Bridget Fonda', 'Sofia Coppola', 'Leif Valan', 'Frank D'Ambrosio', 'Donell Donnelly', 'Richard Bright', 'Helmut Berg', 'Don Novello']",8.9,"In the blink of an eye, it is already 1979. The second-generation godfather, Mike Corleone (played by Al Pacino), is in his twilight years. In order to save his soul, Mike slowly ends his family's underworld business and switches to legitimate business.
                                    
                                Michael's son Tony loves art and has no intention of taking over the family business. Michael decides to let his eldest brother Sunni's illegitimate son, the hot and lustful Vincent (Andy Garcia), inherit the family business and become the third generation godfather. Mike's daughter Mary (played by Sofia Coppola) falls in love with Vincent, but her father opposes it, and father and daughter gradually become estranged.
                                    
                                In order to legalize the family assets, Mike prepared to invest in the ""Standing"" Group through his network in the Vatican. However, he was secretly obstructed by his enemies. The death of the Pope also made things more complicated and confusing.
                                    
                                In desperation, Mike could only choose to use violence to solve the problem again, and his relatives were also involved in this bloody storm.",Drama/Crime,https://www.imdb.com/title/tt0099674,English / Italian / German / Latin,170分钟,
194,Book of Heaven and Strange Tales,https://img1.doubanio.com/view/photo/s_ratio_poster/public/p2515539487.jpg,Chinese mainland,1983(中国大陆),Wang Shuchen,"['Ding Jianhua', 'Bike', 'Su Xiu', 'Cheng Xiaohua', 'Shi Rong', 'Yu Ding', 'Yang Chengchun', 'Sun Yufeng', 'Hu Qinghan', 'Shanghua', 'Liu Guangning', 'Qiao Zhen', 'Yan Chongde', 'Wu Jingwei', 'Tong Zirong', 'Cheng Yuzhu', 'Cao Lei', 'Wang Jianxin', 'Yang Wenyuan', 'Fu Runsheng', 'Liu Qin', 'Liu Feng', 'Zhai Wei', 'Zhang Xin', 'Guo Yifeng', 'Wang Xiaobing']",9.2,"There is a rare book ""Book of Heaven"" in heaven, which has been locked in a stone niche for three thousand years. Duke Yuan, who was guarding the Book of Heaven, was very curious about the contents of the Book of Heaven. He secretly took it out to read when no one was around. It turns out that there are 108 magic spells recorded in the Heavenly Book. move, which was intended to benefit mankind, violated the laws of heaven and was punished by the Jade Emperor.
                                    
                                The elixir in the alchemy furnace was accidentally eaten by three foxes. They turned into spirits and defrauded people of their money.",Animation/Fantasy,https://www.imdb.com/title/tt6035092,Mandarin Chinese,89分钟,
195,Saw,https://img9.doubanio.com/view/photo/s_ratio_poster/public/p2565332644.jpg,USA,2004-01-19(圣丹斯电影节),James Wan,"['Ray Whannell', 'Cary Elwes', 'Danny Glover', 'Ken Leung', 'Dina Meyer', 'Mike Butters', 'Paul Goodluck', 'Michael Emerson', 'Benito Martinez', 'Shawnee Smith', 'Mackenzie Vega', 'Monica Porter', 'Ned Barami', 'Alessandra Quan', 'Tobin Bell']",8.7,"Adam (Leigh Whannell) wakes up and finds himself trapped in an abandoned toilet. Opposite him is Lawrence (Cary Elwes) who has the same fate - their legs were tied with chains, and they were surprised to find a terrifying dead man lying between them. The dead man was dripping with blood, holding a video player in his left hand and a gun in his right hand.
                                    
                                Someone put a tape into Adam's pocket, and he quickly put it into the VCR. The tape said that Lawrence must kill Adam before 6 o'clock tonight, otherwise the two of them will die together, and Lawrence's family will not be spared. The blood flowing from the dead man in front of him was extremely poisonous.
                                    
                                A bloody death game begins. In the little time left, they must find clues and escape from hell. At the last moment, when they thought they would see the light of day again, a new round of nightmare had just begun.",Suspense/Thriller/Horror,https://www.imdb.com/title/tt0387564,English,103分钟,
196,wedding banquet,https://img9.doubanio.com/view/photo/s_ratio_poster/public/p2173713676.jpg,Taiwan / United States,1993-02(柏林电影节),Ang Lee,"['Zhao Wenxuan', 'Lang Xiong', 'Gui Yalei', 'Jin Sumei', 'Mitchell Lichtenstein']",8.9,"Wei Tong (Zhao Wenxuan) is a successful gay man who lives happily together with his boyfriend Simon (Mitchell Lichtenstein) in the United States. His troubles come from having to use various tricks to deal with forced marriages from his parents (Lang Xiong) and mother (Gui Yalei) who are far away in Taipei. Wei Tong was forced to write a letter as a ""good boy"" claiming that he would get married in the United States. Unexpectedly, his parents wanted to witness it with their own eyes. Helpless, he had no choice but to marry Weiwei (Jin Sumei), an unsuccessful female artist from Shanghai, in a ""fake marriage"" in order to escape.
                                    
                                The parents were quite satisfied with Weiwei, but were dissatisfied with Wei Tong's hasty attitude. In order to satisfy his parents and return to Taipei as soon as possible, Wei Tong, like a ""desperate man"", tried his best. But God is not as good as man, and constant twists and turns have delayed his parents' return to Taiwan again and again, causing a ""red light"" in his relationship with Simon, and Weiwei unexpectedly became pregnant with his child. It seems that in The face of powerful parents (tradition), Wei Tong can only choose to be a ""appearing normal"" man.",Drama/Comedy/Romance/Gay/Family,https://www.imdb.com/title/tt0107156,Mandarin Chinese / English,108分钟,
197,The true nature of a hero,https://img1.doubanio.com/view/photo/s_ratio_poster/public/p2504997087.jpg,"Hong Kong, China",1986-08-02(中国香港),John Woo,"['Chow Yun-fat', 'Ti Lung', 'Leslie Cheung', 'Zhu Baoyi', 'Li Zixiong', 'Tian Feng', 'Wu Yusen', 'Tsang Kong', 'Shing Kui'an', 'Tsui Hark', 'Chen Chi Fai']",8.7,"Song Zihao (played by Ti Lung) and Mark (played by Chow Yun-fat), important members of an international counterfeit banknote syndicate in Hong Kong, are brothers. When Song Zihao took his subordinate Tan Cheng (played by Li Zixiong) to Taipei for business, he was betrayed by Tan Cheng (played by Li Zixiong) and was shot and imprisoned. In order to avenge his good brother, Mark went to Taiwan alone, but was beaten into a cripple. His status in the world plummeted, and Song Zihao's father also died soon. Song Zijie (Leslie Cheung), who has always regarded Song Zihao as his idol, learned about his brother's true identity and hated the underworld and him. He vowed to use his identity as a police officer to eradicate the gangs. After Song Zihao was released from prison, he ignored the dissuasion of Mark who was waiting for him and wanted to restore his glory. At this time, Tan Cheng, who has become the gang boss, wanted to cooperate with Song Zihao again. After being rejected, he threatened to harm Song Zijie. He was forced to have no choice but to join hands with Mark to fight against the powerful enemy.",Drama/Action/Crime,https://www.imdb.com/title/tt0092263,Cantonese / Mandarin Chinese / English,95分钟,
198,Django Unchained Django Unchained,https://img1.doubanio.com/view/photo/s_ratio_poster/public/p1959232369.jpg,USA,2013-05-12(中国大陆),quentin tarantino,"['Jamie Foxx', 'Leonardo DiCaprio', 'Christoph Waltz', 'Samuel L. Jackson', 'Kerry Washington', 'Walton Goggins', 'Dennis Christopher', 'Jonah Hill', 'James Remar', 'Amber Tamblyn', 'Franco Nero', 'Robert Carradine', 'Zoe Bell']",8.7,"1858, two years before the American Civil War. German bounty hunter Kim Schultz (Christoph Waltz) buys the black slave Django (Jamie Foxx) from a slave trader and allows him to regain his freedom. Schultz actually wanted to train Django to be a lawless bounty hunter who would hunt down various wanted criminals in exchange for rewards. Django's only condition is to rescue his wife Broomhilda (Kerry Washington) from the cruel candy manor owner Calvin Candy (Leonardo DiCaprio). This film is Tarantino's tribute to the 1966 classic Italian Western ""Diego"" directed by Sergio Corbusi.
                                        
                                    The genius director Quentin has been sharpening his skills for three years and has produced another masterpiece after ""Inglourious Basterds"". This film continues Quentin's consistent low-key and luxurious style, with whimsical humor elements and bloody and wild action scenes everywhere. It also has powerful group scenes and a luxurious cast, making it full of attractions.
                                        
                                    ""Django Unchained"" won the 85th Oscars...",Drama/Action/Western/Adventure,https://www.imdb.com/title/tt1853728,English / French / German,163分钟(中国大陆),
199,The Bourne Ultimatum,https://img1.doubanio.com/view/photo/s_ratio_poster/public/p792223507.jpg,USA/Germany,2007-11-15(中国大陆),Paul Greengrass,"['Matt Damon', 'Julia Stiles', 'David Strathairn', 'Scott Glenn', 'Paddy Considine', 'Edgar Ramirez', 'Albert Finney', 'Joan Allen', 'Tom Gallop', 'Kerry Johnson', 'Daniel Brühl', 'Joy Ansah', 'Colin Stinton', 'Dan Fredenberg', 'Lucy Liemann']",8.8,"After losing his beloved woman, Bonn (played by Matt Damon) is facing a more difficult life. He tries to remember, but he can only be awakened by flashbacks that he barely understands in his sleep, and he still cannot remember his identity.
                                    
                                But Bonn is not destined to be an ordinary person. Before he can calm down and ""find"" his true identity, the killers sent by the CIA come one after another. After several consecutive battles, Jason Bourne was finally completely irritated and decided to fight back - he took the initiative to pursue the killer and traveled to Moscow and Madrid. Paris, and also made stops in London and Tangier.
                                    
                                As the problems are solved one by one, Jason returns to New York, where he will find all the answers and regain his identity.",Action/Suspense/Thriller,https://www.imdb.com/title/tt0440963,English / French / Arabic / Russian / Spanish,115分钟,
200,The Godfather: Part Ⅱ,https://img1.doubanio.com/view/photo/s_ratio_poster/public/p2194138787.jpg,USA,1974-12-12(纽约首映),Francis Ford Coppola,"['Al Pacino', 'Robert Duvall', 'Diane Keaton', 'Robert De Niro', 'John Keizer', 'Talia Shire', 'Lee Strasberg', 'Michael V. Gozo', 'G.D. Spradlin', 'Richard Bright', 'Gaston Mosin', 'Tom Rosqui', 'Bruno Kirby', 'Frank Silvero', 'Francesca De Savio', 'Morgana Gold', 'Mariana Hill', 'Leopoldo Triesti', 'Dominique Chanis', 'Amerigo Tot', 'Troy Donahoo', 'John Aprea', 'Joe Spinel', 'Abe Vigoda', 'Gianni Russell', 'Maria Carta', 'Faye Spann', 'Harry Dean Stanton', 'Cami Caridi', 'Danny Aiello', 'William Powers', 'Joseph de la Salte', 'Carmen Argenziano', 'Joe Lo Grip', 'Ezio Flagello', 'Catherine Belle', 'Saveria Mazzola', 'Tito Alba', 'Peter Donat', 'Tom Dahlgren', 'Phil Feldman', 'Roger Corman', 'Ivan Cole', 'Erica Yorn', 'Teresa Tirelli', 'James Caan', 'Italia Coppola', 'Roman Coppola', 'Sofia Coppola', 'Julie Gregg', 'George Holmes', 'Buck Houghton', 'Shep Houghton', 'Kosugi Shoichi', 'Gary Kurtz', 'Laura Lyons', 'Richard Matheson', 'John Megenna', 'Harrison Ressler', 'Al Roberts', 'Hank Robinson', 'Filomena Spagnuolo']",9.2,"Michael (Al Pacino) is the leader of the Corleone family of the American mafia. Michael's father, Vito Andolini (played by Robert De Niro), was born in the Italian town of Corleone. In 1901, Vito's father Antonio, brother Paul, and mother (played by Maria Cata) all died at the hands of the Mafia Ciccio family. 9-year-old Vito had no choice but to flee across the ocean to the United States to make a living. Upon entry, the customs officer (played by Richard Watson) registered his name as Vito Corleone. In 1958, Michael held a First Communion party for his son Anthony (played by James Gounaris), but he did not want to be assassinated that night. Michael escaped by chance, but the two killers were silenced. How does Vito survive in a foreign country? Can the blood feud he bears be avenged? Who wants Michael's life? Who was it that silenced the killer?",Drama/Crime,https://www.imdb.com/title/tt0071562,English / Italian / Spanish / Latin / Sicilian,202分钟,
201,The Lord of the Rings: The Two Towers The Lord of the Rings: The Two Towers,https://img9.doubanio.com/view/photo/s_ratio_poster/public/p909265336.jpg,USA / New Zealand,2003-04-25(中国大陆),peter jackson,"['Elijah Wood', 'Sean Astin', 'Dominic Monaghan', 'Orlando Bloom', 'Viggo Mortensen', 'Ian McKellen', 'Cate Blanchett', 'Billy Boyd', 'Jade Brophy', 'Liv Tyler', 'Andy Serkis', 'Miranda Otto', 'Hugo Weaving', 'Brad Dourif', 'Callum Gittins', 'Bernard Hill', 'Bruce Hopkins', 'Christopher Lee', 'Nathaniel Lees', 'Robin Malcolm', 'John Bassey', 'Sarah Baker', 'Craig Parker', 'Bruce Phillips', 'Robert Pollock', 'John Rhys-Davies', 'Olivia Tané', 'Karl Urban', 'Stephen Urie', 'David Wenham', 'Philip Grieve', 'Sean Bean', 'John Noble', 'Jarl Benzon', 'Jørn Benzon', 'Ben Britton', 'Alistair Browning', 'Sean Button', 'Robert Catto', 'Rodney Cook', 'Carlos Drinkwater', 'Theo Shafowa', 'Ben Fransham', 'Jonathan Harding', 'Lucas Hayward', 'Dan Hanna', 'Paul Holmes', 'Jason Hodder', 'Peter Jackson', 'Sam Kelly', 'Sandro Kopp']",9.1,"While the second part continues the style of the first part, the story presents a multi-line development pattern, making the plot more enjoyable to watch.
                                        
                                    At the end of the first part, after Boromir was killed by the orcs, two hobbits, Pippin and Merry, were also kidnapped by the orcs. Aragorn, the elf Legolas (played by Orlando Bloom), and the dwarf Gimli tracked the orcs, rescued Pippin and Merry, and met the ""resurrected"" white-robed wizard Gandalf (played by Ian McKellen). At this time, Saruman, the white-robed wizard who surrendered to Sauron, controlled the king of the human kingdom of Lohan and sent a large number of orc troops to prepare to destroy humans. Aragorn, Legolas and Jinli, under the leadership of Gandalf, helped the Kingdom of Lohan fight the invasion of evil forces.
                                        
                                    Fortunately, Pippin and Merry were rescued by the talking dryad and met the ""resurrected"" Gandalf. Under Gandalf's instruction, the dryad protected the safety of the two and took them to the dryad conference. At the conference, the dryads discussed their attitude towards the war in Middle-earth: should they continue to be neutrals and accept the situation, or should they rise up and resist?
                                        
                                    Frodo (Elijah Wood) and Sam, who are burdened with heavy responsibilities, continue to move towards the Mountains of Doom. They are followed by Gollum along the way. Frodo relies on...",Drama/Action/Fantasy/Adventure,https://www.imdb.com/title/tt0167261,English / Sindarin / Old English,179分钟,
202,The Lion King The Lion King,https://img1.doubanio.com/view/photo/s_ratio_poster/public/p2277799019.jpg,USA,1995-07-15(中国大陆),Roger Allers,"['Jonathan Taylor Thomas', 'Matthew Broderick', 'Jeremy Irons', 'James Earl Jones', 'Moira Kelly', 'Nathan Lane', 'Nikita Karam', 'Ernie Sabella', 'Whoopi Goldberg', 'Rowan Atkinson']",9.0,"Simba is the little prince of the Lion Kingdom, and his father Mufasa is a majestic king. However, Uncle Scar has been coveting Mufasa's throne for a long time.
                                    
                                To sit on the throne, Scar must get rid of the little prince. Therefore, Scar used various excuses to let Simba go out, and then waited for an opportunity to kill, but Mufasa came to rescue him immediately. After repeated calculations, Mufasa died tragically at the hands of Scar. Scar persuaded Simba to leave with ulterior motives, and on the one hand, he sent people to drive him away and kill him.
                                    
                                During his escape, Simba met the witty Timon and the kind-hearted Peng Peng. They raised Simba to grow into a majestic lion and encouraged him to return to the forest to restore his country. In the ensuing struggle to restore the country and save the people, Simba truly grew into a strong man and understood the true meaning of responsibility.",Animation/Song and Dance/Adventure,https://www.imdb.com/title/tt0110357,English / Swahili / Xhosa / Zulu,89 分钟,
